{
  "decision_id": "P1-SPEC-07-COMPILER-CONSERVATION-REVIEW-001",
  "subject_hash": "dbe63902a17cabe7938080658b5edb5a4c118f9410aa2ec851ab6f05aff47f0f",
  "decision": "APPROVED",
  "reviewer": "human-user",
  "open_blockers": [],
  "approved_sections": [
    "COMPILER_CONSERVATION_CONTRACT.md",
    "FINAL_DRD_ASSEMBLY_RULES.md",
    "COMPILER_INPUT_BOUNDARY_RULES.md",
    "COMPILER_PROJECTIONS.md",
    "COMPILER_VALIDATOR_SPEC.md",
    "COMPILER_EXAMPLES.md",
    "COMPILER_IMPLEMENTATION_BLUEPRINT.md",
    "CANDIDATE_MANIFEST.json",
    "PART_SELF_CHECK.md",
    "HANDOFF.md"
  ]
}
