{
  "decision_id": "P1-SPEC-08-SKILLS-WORKPACK-TRACEABILITY-REVIEW-001",
  "subject_hash": "22bbbe2ae6e378d64675cc193d3ffb19ca37e7e5d4b7ae89762cd0a85b5d2d9a",
  "decision": "APPROVED",
  "reviewer": "human-user",
  "open_blockers": [],
  "approved_sections": [
    "SPEC_TO_CODE_TRACEABILITY_CONTRACT.md",
    "SKILL_VERSION_BINDING_CONTRACT.md",
    "WORKPACK_GENERATION_CONTRACT.md",
    "SPEC_BEFORE_CODE_RULES.md",
    "TRACEABILITY_PROJECTIONS.md",
    "SKILLS_WORKPACK_VALIDATOR_SPEC.md",
    "SKILLS_WORKPACK_EXAMPLES.md",
    "IMPLEMENTATION_BLUEPRINT.md",
    "CODE_TARGET_MAP.json",
    "TEST_OBLIGATION_MATRIX.json",
    "IMPLEMENTATION_WORKPACK_INDEX.json",
    "CANDIDATE_MANIFEST.json",
    "PART_SELF_CHECK.md",
    "HANDOFF.md"
  ]
}
